{
  "datasetId": "chinook",
  "schemaHash": "sha256:0644df6b308db94188dae735a6bb149eb43bdc498e9d8b8bb7b7c88f3664366f",
  "fields": [
    {
      "name": "invoice_line_id",
      "type": "long",
      "nullability": "NOT_NULL"
    },
    {
      "name": "invoice_id",
      "type": "long",
      "nullability": "NOT_NULL"
    },
    {
      "name": "track_id",
      "type": "long",
      "nullability": "NOT_NULL"
    },
    {
      "name": "unit_price",
      "type": "double",
      "nullability": "NOT_NULL"
    },
    {
      "name": "quantity",
      "type": "long",
      "nullability": "NOT_NULL"
    }
  ],
  "candidateKeys": [
    {
      "fields": [
        "invoice_line_id"
      ],
      "confidence": 1.0,
      "evidence": {
        "uniquenessRatio": 1.0,
        "nonNullRatio": 1.0,
        "cardinality": 2240
      },
      "sampleRows": 2240,
      "fullScanVerified": true,
      "evidenceRefs": [
        "sample:invoice_line.parquet"
      ]
    }
  ],
  "candidateEventTimes": [],
  "rowCount": 2240,
  "nullRates": {
    "invoice_line_id": 0.0,
    "invoice_id": 0.0,
    "track_id": 0.0,
    "unit_price": 0.0,
    "quantity": 0.0
  },
  "cardinality": {
    "invoice_line_id": 2240,
    "invoice_id": 412,
    "track_id": 1984,
    "unit_price": 2,
    "quantity": 1
  },
  "sensitiveFieldCandidates": [],
  "partitionStats": {},
  "sampleInfo": {
    "totalRows": 2240,
    "sampledRows": 2240,
    "sampleLimit": 100000,
    "fullScan": true,
    "samplingMethod": "full"
  },
  "profiledAt": "2026-08-03T01:29:26.913730+00:00"
}
